{
  "canonical_digest": "sha256:e19d92254d5cb26a955b703042859314952ea5478dd88b777ef2039beb8eea44",
  "component_id": "aset.core",
  "component_version": "0.1-rc1",
  "document_type": "aset-component-threat-model",
  "schema_version": 1,
  "source_version": "1.5-rc11",
  "threats": [
    {
      "attack": "An actor or implementation attempts to accept result.",
      "id": "THREAT-CORE-001",
      "impact": "Authority, epistemic status, execution validity or outcome recognition could be confused across component boundaries.",
      "mitigation": "Closed schemas, explicit ownership, Seed mapping, negative conformance and independent gate checks reject the violation.",
      "status": "MITIGATED_BY_SPECIFICATION",
      "title": "Boundary violation 1"
    },
    {
      "attack": "An actor or implementation attempts to execute external effect.",
      "id": "THREAT-CORE-002",
      "impact": "Authority, epistemic status, execution validity or outcome recognition could be confused across component boundaries.",
      "mitigation": "Closed schemas, explicit ownership, Seed mapping, negative conformance and independent gate checks reject the violation.",
      "status": "MITIGATED_BY_SPECIFICATION",
      "title": "Boundary violation 2"
    },
    {
      "attack": "An actor or implementation attempts to plan.",
      "id": "THREAT-CORE-003",
      "impact": "Authority, epistemic status, execution validity or outcome recognition could be confused across component boundaries.",
      "mitigation": "Closed schemas, explicit ownership, Seed mapping, negative conformance and independent gate checks reject the violation.",
      "status": "MITIGATED_BY_SPECIFICATION",
      "title": "Boundary violation 3"
    },
    {
      "attack": "An actor or implementation attempts to rewrite submission.",
      "id": "THREAT-CORE-004",
      "impact": "Authority, epistemic status, execution validity or outcome recognition could be confused across component boundaries.",
      "mitigation": "Closed schemas, explicit ownership, Seed mapping, negative conformance and independent gate checks reject the violation.",
      "status": "MITIGATED_BY_SPECIFICATION",
      "title": "Boundary violation 4"
    }
  ]
}
