{
  "canonical_digest": "sha256:131bdc21d05f7719763e1ef4ba8664295ced65f0113fc9ed51605272ebcd8914",
  "component_id": "aset.model-gateway",
  "component_version": "0.1-rc1",
  "document_type": "aset-component-threat-model",
  "schema_version": 1,
  "source_version": "1.5-rc11",
  "threats": [
    {
      "attack": "An actor or implementation attempts to change PromptManifest.",
      "id": "THREAT-GATEWAY-001",
      "impact": "Authority, epistemic status, execution validity or outcome recognition could be confused across component boundaries.",
      "mitigation": "Closed schemas, explicit ownership, Seed mapping, negative conformance and independent gate checks reject the violation.",
      "status": "MITIGATED_BY_SPECIFICATION",
      "title": "Boundary violation 1"
    },
    {
      "attack": "An actor or implementation attempts to execute tool call.",
      "id": "THREAT-GATEWAY-002",
      "impact": "Authority, epistemic status, execution validity or outcome recognition could be confused across component boundaries.",
      "mitigation": "Closed schemas, explicit ownership, Seed mapping, negative conformance and independent gate checks reject the violation.",
      "status": "MITIGATED_BY_SPECIFICATION",
      "title": "Boundary violation 2"
    },
    {
      "attack": "An actor or implementation attempts to own canonical context.",
      "id": "THREAT-GATEWAY-003",
      "impact": "Authority, epistemic status, execution validity or outcome recognition could be confused across component boundaries.",
      "mitigation": "Closed schemas, explicit ownership, Seed mapping, negative conformance and independent gate checks reject the violation.",
      "status": "MITIGATED_BY_SPECIFICATION",
      "title": "Boundary violation 3"
    }
  ]
}
