{
  "canonical_digest": "sha256:244151debf82f397db740e8fbabd3fee82c8846191747176990c54d70f8c86e1",
  "component_id": "aset.system",
  "component_version": "0.1-rc1",
  "document_type": "aset-component-threat-model",
  "schema_version": 1,
  "source_version": "1.5-rc11",
  "threats": [
    {
      "attack": "An actor or implementation attempts to collapse expectation and execution permits.",
      "id": "THREAT-SYSTEM-001",
      "impact": "Authority, epistemic status, execution validity or outcome recognition could be confused across component boundaries.",
      "mitigation": "Closed schemas, explicit ownership, Seed mapping, negative conformance and independent gate checks reject the violation.",
      "status": "MITIGATED_BY_SPECIFICATION",
      "title": "Boundary violation 1"
    },
    {
      "attack": "An actor or implementation attempts to recognize Outcome without Verification.",
      "id": "THREAT-SYSTEM-002",
      "impact": "Authority, epistemic status, execution validity or outcome recognition could be confused across component boundaries.",
      "mitigation": "Closed schemas, explicit ownership, Seed mapping, negative conformance and independent gate checks reject the violation.",
      "status": "MITIGATED_BY_SPECIFICATION",
      "title": "Boundary violation 2"
    },
    {
      "attack": "An actor or implementation attempts to hide incompatible component versions.",
      "id": "THREAT-SYSTEM-003",
      "impact": "Authority, epistemic status, execution validity or outcome recognition could be confused across component boundaries.",
      "mitigation": "Closed schemas, explicit ownership, Seed mapping, negative conformance and independent gate checks reject the violation.",
      "status": "MITIGATED_BY_SPECIFICATION",
      "title": "Boundary violation 3"
    }
  ]
}
